{
  "trace_id": "sample-001",
  "session_id": "demo-session",
  "metadata": {
    "orchestrator": "example",
    "model": "gpt-4"
  },
  "messages": [
    {
      "role": "system",
      "content": "You are a software engineering agent. Be concise."
    },
    {
      "role": "user",
      "content": "Fix the bug in crates/tokenopt-core/src/lib.rs and run cargo test."
    },
    {
      "role": "assistant",
      "content": "I'll read crates/tokenopt-core/src/lib.rs first.",
      "tool_calls": [
        {
          "id": "call_read_1",
          "type": "function",
          "function": {
            "name": "read_file",
            "arguments": "{\"path\":\"crates/tokenopt-core/src/lib.rs\"}"
          }
        }
      ]
    },
    {
      "role": "tool",
      "tool_call_id": "call_read_1",
      "name": "read_file",
      "content": "//! tokenopt-core\npub mod compile;\n// ... repeated content ...\n"
    },
    {
      "role": "assistant",
      "content": "Running tests.",
      "tool_calls": [
        {
          "id": "call_shell_1",
          "type": "function",
          "function": {
            "name": "shell",
            "arguments": "{\"command\":\"cargo test -p tokenopt-core\"}"
          }
        }
      ]
    },
    {
      "role": "tool",
      "tool_call_id": "call_shell_1",
      "name": "shell",
      "content": "error: test compile_reduces_tokens failed\nexit code: 101\n"
    }
  ]
}
